Rumen pharmacology,  முதலிரைப்பை - மருந்தியல், 
Saltierra,  உப்பேரி ஆவியாக்கவழி - உப்புப்படுகை, 
Saltimbanco,  போலி மருத்துவர், 
Salmalia insignis,  பாரையிலவு, 
Salmon,  வஞ்சிரம்: மீன் வகை// சால்மன், 
Salmon-ladder,  அணை மீனேணி, 
Salmonoid,  வஞ்சிரம் போன்ற, 
Salmon oil,  வஞ்சிர நெய்யம்/ வஞ்சிரமீன் எண்ணெய், 
Salmon trout,  தடிப்புக் குறுவஞ்சிரம், 
Saloon-bar,  தேறல் கூடம், 
Salpingectomy,  கருப்பைக்குழல் நீக்கறுவை சினைக்குழல் நீக்கறுவை, 
Salpingemphraxis,  காது - தொண்டைக்குழல் அடைப்பு, 
Salpingiani,  செவிக்குழல் சார்ந்த/ கருப்பைக்குழல் சார்ந்த, 
Salpingitic,  செவிக்குழலழற்சி சார்ந்த/ கருப்பைக் குழலழற்சி சார்ந்த, 
Salpingitis,  கருமுட்டைக்குழாய் அழற்சி/ கருப்பைக் குழலழற்சி சினைக்குழலழற்சி// செவிக்குழலழற்சி/ கருப்பைக்குழாய் அழற்சி, 
Salpingocele,  கருப்பைக்குழல் - பிதுக்கமுத்துருத்தம், 
Salpingogram,  சினைக்குழல் வரைபடம், 
Salpingography,  கருப்பைக்குமுல் - கதிர்ப்பட வரைவு, 
Salpingolysis,  கருப்பைக் குழலொட்டுப் பிரிப்பறுவை, 
Salpingo-oophorectormy,  கருப்பைக்குழல் சூலக நீக்சுறுவை, 
Salpingo-oophoritis,  கருப்பைக் குழல் - சூலகவழற்சி, 
Salpingopexy,  கருப்பைக்குழல் பொருத்தறுவை, 
Salpingopharyngeal,  செவிக்குழல்-தொண்டை சார்ந்த, 
Salpingoplasty,  கருப்பைக்குழல் - ஒட்டறுவை, 
Salpingostomy,  கருப்பைக்குழல் - புரைவாய்/ கருப்பைக்குழல்- வாய்திறப்பு// சினைக்குழல் துளையிடல், 
Salpingotomy,  கருப்பைக்குழல் துமிப்பறுவை, 
Salt-affected soil,  உப்புத் தாக்க மண், 
Saluresis,  உவர்மியம் - பாசிகமின்மச் சிறுநீரகற்சி, 
Saluretic,  உவர்மியம் - பாசிகமின்மச் சிறுநீரகற்சிமுகவி, உவர்மியம் பாசிகமின்மச் - சிறுநீரகற்சியை மிகுதிப்படுத்துகின்ற, 
Saluting gun,  சுடுகை வணக்க வேட்டெஃகம், 
Salvage,  கடல் இடர்காப்புக் பாதுகாப்பு தொகை, அழிவுமீட்புச் செய்: மீதிப்பொருள்/ கடல் - இடர்காப்புக் கட்டணம், அழிவு மீட்பு, அழிவுக்காப்புச் செய், அழிவுமீட்பு, அழிவுக்காப்பு// சாமான்களை விபத்திலிருந்து காத்தல், அழிவுக் காப்பு, 
Salvage procedures,  சுடல்-இடர்காப்புச் செயன்முறைகள், 
Salvage value,  மீட்பு மதிப்பு/ வயிர எச்சமதிப்பு/ கடைக்கால மதிப்பு, 
Salvage vessel,  இடர்காப்புக் கலம்: மீட்புக் கலம், 
Salvia officinalis,  கஞ்சங்கோரை, 
Salvia oil,  கஞ்சங்கோரை நெய்யம், 
Salvor,  மீட்புப் பணிஞர், 
SAm,  பவாக, 
Samarea saman,  சீமை வாகை, தூங்குமூஞ்சி மரம், 
Samara,  சிறகுக்கனி, 
Samarium-cobalt magnet,  சாமரியம் வெண்வண்ணிக் காந்தம், 
Samaroid,  மேல்வயிரம், 
Samarskite,  சாமவூரணியம், 
Same configuration,  ஒத்த உருவமைப்பு, 
Same phase,  ஒரே கூறு, ஒரே தறுவாய், ஒரே கட்டம், 
Same stratum,  அதே அடுக்கு, 
Sampan,  முப்பலகைப் படகு, 
Sample block,  மாத்தரித் தொகுதி: மாதிரித் தொகுதி, 
Sample census,  மாதிரி மக்கள் தொகைக் கணக்கெடுப்பு: மாத்தரி மக்கள்தொகைக் கணக்கு எடுப்பு, 
Sampled data,  வகைக்கூற்றுத் தரவு: மாத்தரித் தரவு, பதத்தரவு, 
Sampled data control system,  வகைக்கூற்றுத்தரவு - கட்டுப்பாட்டுத் தொகுதி, பதத்தரவு கட்டுப்பாட்டு அமைப்பு, 
Sample log,  மாத்தரிப் பதிவுரு, பதப்பதிவு, 
Sample of clusters,  தொகுதிகளின் மாதிரிகள்/ கொத்துக்களின் மாத்தரி, 
Sampler,  மாத்தரித் தொகை, பதக்கூறெடுப்பவர், பதக்கூறெடுப்பி, 
Sampler  Salting,  உப்பிடல், 
Salting-in,  உப்பிட்டுக் கரைத்தல், 
Salting-out,  உப்பிட்டுப் பிரித்தல், 
Salting-out effect,  உப்பிட்டுப்- பிரித்தல் விளைவ, 
Salt-lick,  உப்புக்குழி, உப்பு மண் நக்கிடம், 
Salt linkage,  உப்புக்கோவை, உப்பு ஒதுக்கீடு, 
Saltmarsh,  உவர்ச்சதுப்புநிலம், உவர்களறு, 
Saltmarsh plain,  உவர்ச்சதுப்பு உயர்வெளி, 
Saltmarsh plant,  உவர்ச் சதுப்புப்புதல், 
Salt meadow,  உவர்ப் புல்வெளி, 
Salt mine,  உப்புச் சுரங்கம், உவர்ப்பாறைச் சுரங்கம், 
Saltpeter earth,  வெடியுப்புப் படிவு// சுண்ணக வெடியகிப் படிவுநிலம், 
Salt pillow,  மூல உப்புமேடு, உப்புத் - தலையணை, 
Salt pit,  உப்புக் குழி, உப்புக்குழி, உப்பளக்குழி, 
Salt plug,  கும்மட்டவுப்புக்-கரு, 
Salt polygon,  உப்புப் பலகோணி, உப்புப் பலகோணம், 
Salt solution,  உப்புக்கரைசல், உப்புக் கரைசல், 
Salt spoon,  உப்புக் கரண்டி, 
Salt spray,  உப்புத்தெறிப்பு, உப்புத்தெளிப்பு, 
Salt spray climax,  உப்புத் தெறிப்பு முகடு, 
Saltspray test,  உப்புத்தெளிப்பு-ஆய்வு, 
Salt spring,  உவர் ஊற்று, 
Salt stress tolerant variety,  உப்பு அழுத்தம் தாங்குமவகை, 
Salt tectonics,  உப்புக் கும்மட்ட இயங்கமைப்பியல், உப்பு நிலக்கட்டுமானம், 
Saltus of a function,  சார்பயன் - தாவல், 
Salt velocity meter,  உப்புத் திசைவேக அளவி, உப்பு வேகமானி, 
Salt velocity method,  உப்புவேக முறை, உப்பு வேகமுறை, 
Salt wall,  உப்புச்சுவர், 
Salt water front,  உவர்நீர் முகப்பு/ கடல்நீர் முகப்பு வெளி, 
Salt-water intrusion,  உப்பங்கழி ஊடுருவல், 
Salt water well,  உப்புநீர்க் கிணறு, 
Salt well,  உப்புக்கிணறு, உவர்க் கிணறு, 
Saltworks,  உப்பளம், உப்புப் பணியகம், 
Sandalwood oil,  சாந்த நெய்யம் சந்தன நெய்யம்// சந்தன எண்ணெய், 
Sand apron,  நீர்த்தாங்குக்கரை: மணலாடை/ கூடல்வாய் மணற்படிவு, 
Sndarac,  சாந்தரக்கு, 
Sand auger,  தூசுச்சுழல், 
Sand avalanche,  குன்றுமணல் வீழ்ச்சி: மணல் தொடர்ப்பொழிவு, 
Sand-bag,  மணற்பை, 
Sand blasting,  மணற்பீச்சு: மணற் பீச்சு: மணல் பீச்சு: மணற்பீச்சு மணலூதையிடல், 
Sand blind,  அரைக்குருடு, 
Sand blow,  மணற் சூறையடிப்பு, 
Sand casting,  மண்ணச்சில் வார்ப்பு, 
Sand clay control,  மணற்களி கட்டுப்படுத்தம்: மணற்களி கட்டுப்பாடு, 
Sand conditioning,  மணல் பதப்படுத்தம்: மணல் பதப்படுத்தல்: மால் பதப்படுக்கம், 
Sand cone,  மணற்கூம்பு/ கூம்புவடிவ மணற்படிவு, 
Sand crabs,  மணல் நண்டுகள், 
Sand-crack,  குதிரைக்குளம்பு நோய், 
Sand dike,  மணல் அணைகரை/ கடற்கரை மணல் திட்டு துருத்தம்/ கடற்கரை மணல்திட்டுக் கரை, 
Sand drain,  மணல் வடிகுழற்கால்: மணல் வடிகால், 
Sand dune belt,  எக்கர்ப் பட்டை, 
Sanded,  மணலால் மூடப்பெற்ற, பட்டைச் சீலையால் மென்மையாக்கப்பெற்ற: மணலுடன் கலக்கின்ற, 
Sanderling,  சீற்றுள்ளான்/ வெள்ளை உள்ளான்/ வெள்ளைஉள்ளான், 
Sand filter,  மணல் வடிகட்டி: மணலடுக்கு வடிப்பான்: மணல் வடிப்பி, 
Sand finish,  மணற்பட்டைச்சீலைத் தேய்ப்பு - அறுதிநேர்த்தி, 
Sand flat,  மணல் தட்டை, 
Sandfies,  மணலீக்கள், 
Sample signature book,  மாத்தரி-ஒப்பப் புத்தகம், 
Sample size,  வகைமை அளவு/ கூறின் அளவு/ கூறு அளவு: மாதிரி அளவு, பதக்கூறு அளவு: மாத்தரி அளவு, பதஅளவு, 
Sample space,  கூறுவெளி/ வகைக்கூற்று வெளி, 
Sample splitter,  வகைக்கூறு-பிரிப்பான், 
Sample survey,  மாதிரி ஆய்வு: மாதிரி மதிப்பீடு/ வகைமை அளக்கை, பதஅளக்கை: மாத்தரி அளக்கை: மாதிரி அளக்கை: மாதிரி நில அளவை/ கூறு அளவெடுப்பு, 
Sample verification,  மாத்தரி-சரிபார்ப்பு: மாதிரி சரிபார்த்தல், 
Sample village,  மாத்தரியூர்: மாதிரி கிராமம், 
Sampling,  மாதிரி எடுத்தல்/ கூறு முறை, பதக்கூறு எடுத்தல்: மாதிரிக் கூறு, பதக்கூறெடுத்தல்/ கூறெடுத்தல்// சட்டகப் பதக்கூறெடுத்தல், பலகட்டப் பதக்கூறெடுத்தல், எளிய சமவாய்ப்புப் பதக்கூறெடுத்தல்/ கனிமப் பதம்பார்ப்புப் பள்ளம், பதக்கூறெடுத்தலின் ஏற்ற இறக்கம்/ வரிசைமுறைப் பதக்கூறெடுத்தல், ஒற்றைப் பதக்கூறு எடுத்தல்// சமவாய்ப்புப் பதக்கூறெடுத்தல்;- இரட்டைக் கூறு முறை, அடுக்குறு பதக்கூறெடுத்தல், திரள் கூறு முறை;- இரட்டைப் பதக்கூறு எடுத்தல், உகப்புப் பதக்கூறெடுத்தல், அலகுப் பதக்கூறு, பதம் எடுத்தல், பதக்கூறு சட்டம்: முறையாகப் பதக்கூறெடுத்தல்/ கூறெடுப்பு / கூறுதேறுகை, பன்முறைப் பதக்கூறு எடுத்தல்: மாதிரிமுறைசார் பிழை: மாதிரி சேர்ப்பித்தல், 
Sampling bottle,  பதம்பார்ப்புக் குப்பி/ வகைக்கூற்றுப் புட்டில், 
Sampling circuit,  பத மின்சுற்று: மாத்தரி-மின்சுற்று, 
Sampling distribution,  கூறின் பரவல்/ கூறுமுறைப்பரம்பல்/ கூறு பரவல்/ கூறுப் பரவல்/ கூறுமுறைப் பரவல், பதம்பார்ப்புப் பகிர்வு: மாதிரிப் பரவல், பதக்கூறின் பரவல், 
Sampling error,  கூறுதேறுகைப் பிழை/ கூறெடுப்பின் பிழை/ கூறு பிழை, பதம்பார்ப்புப் பிழை/ கூறெடுத்தலில் பிழை: மாதிரிமுறைசார் பிழை, பதக் கூறெடுப்புப் பிழை: மாதிரிக் கூறு பிழை, 
Sampling fraction,  வகைக்கூறு-பின்னம், பதம்பார்ப்புப் பின்னம்/ கூறு பின்னம்/ கூறு தகவு: மாதிரிக் கூறு பின்னம், 
Sampling gate,  பதம்பார்ப்பு வாயில்/ வகைக்கூற்றுப்படலைச்சுற்று, 
Sampling interval,  பதம்பார்ப்பு இடைவெளி/ வகைக்கூற்றுத் துடிப்புகள் - இடைநேரம், 
Sampling method,  மாதிரிக் கூறு  முறை/ கூறெடுத்தல் முறை, பதமெடுப்பு முறை/ வகைக்கூறு-முறை, பதக்கூறு முறை, 
Sampling pipe,  பதம்பார்ப்புக் குழாய்/ வகைக்கூற்றுக் குழாய், 
Sampling rate,  பதம்பார்ப்பு வீதம்/ வகைக்கூற்றுத் தகைவேகம், பதம் எடுப்பு வீதம், 
Sampling spark chamber,  வகைக்கூறுவிளைப்புப் பொறியறை, பதம்பார்ப்புத் தீப்பொறி அளவு, 
Sampling spoon,  பதக் கரண்டி/ வகைக்கூறெடுப்புக் கரண்டி, 
Sampling system,  வகைக்கூறு எடுப்பு முறை, பதம்எடுப்பு அமைப்பு, 
Sampling techniques,  வகைக்கூறெடுப்பு உத்திகள், பதம்பார்ப்பு உத்திகள், 
Sampling theorem,  பதம்பார்ப்புத் தேற்றம்/ வகைக்கூறெடுப்பு உத்தித் தேற்றம், 
Sampling theory,  வகைக்கூறெடுப்புக்கொள்கை, பதம்பார்ப்புக் கோட்பாடு, 
Sampling time,  தொடரளவீட்டு - இடைநேரம், பதம்பார்ப்பு நேரம், 
Sampling unit,  கூறலகு/ வலைக்கூறு - ஒக்கம்: மாதிரிக் கூறு அலகு, 
Sampling without replacement,  ஈடுகட்டாது கூறெடுப்பு, 
Sampling with replacement,  ஈடுகட்டிக் கூறு எடுத்தல், ஈடுகட்டிக் கூறெடுப்பு, 
Sanative,  பிணிநீக்கும் திறனுடைய; நலப்படுத்துகின்ற; நோய் தணிக்கவல்ல, 
Sanatorium,  நலவழி நிலையம்; நல வழி நிலையம்/ காசநோய்க் காப்பகம்; நலமாக்கு நிலையம்; நல மருத்துவ நிலையம்; நலஆக்க நிலையம்; நல ஆக்க நிலையம், 
Sanatory,  நலவழிப்படுத்தத்திற்குரிய, 
Sanctification,  தூய்மைப்படுத்துதல்// செந்துய்யப்படுத்தம், புனிதப்படுத்தல், 
Sanctifier,  செந்துய்யுறுத்தி, 
anctimony,  திருநிலைப் பகட்டாரவாரம், 
Sanctioned limit,  ஒப்பளிப்புற்ற வரம்பு, 
Sanctioned norm,  ஒப்பளிப்புற்ற நெறிமுறை, 
Sanctioned post,  ஒப்பளிப்புப் பெற்ற பதவி, ஒப்பளிப்புற்ற பதவி, 
Sanctioning authority,  ஒப்பளிக்கும் அதிகாரி, ஒப்பளிப்புத் தரும் அதிகாரி, அதிகார ஆயம், ஒப்பளிப்பதிகாரி, ஒப்பளிப்பு வழங்கும் அதிகாரக்குழு, ஒப்பளிப்புச் செய்யும் அதிகாரி, 
Sanctioning order,  ஒப்பளிப்பு ஆணை, ஒப்பளிப்பாணை, ஒப்பளிப்புச் செய்யும் ஆணை/ கட்டளை, 
Sanction of advance,  முன்பண ஒப்பளிப்பு, 
Sanctities,  திருநிலைக் கடப்பாடுகள், 
Sand plover,  மணல் உப்புக்கொத்தி, 
Sand pump dredger,  மணலெக்கி வாரி, 
Sand rat,  மணல் எலி, 
Sand reel,  மணல் எக்கி உருளை: மணற்சுருளி, 
Sand return,  மணற்புரள்வு, 
Sand run,  இயங்கும் வரள்மணல் திரட்சி: மணலோட்டம்: மணல் ஓட்டம், 
Sands,  கரட்டு வன்தாதுப் பரல்கள், 
Sand scour,  மணலரிப்பு, 
Sand shadow,  மணற்சாயை, 
Sand shark,  மணற்கறா, 
Sand sheet,  மணல் தாளம் : மணல் படலம்: மணல்தகடு, 
Sand slinger,  மணலெறி எந்திரம்: மணல் எறி எந்திரம், 
Sand sluice,  தூர்வாரு மதகு: மணல்வாரி மதகு, 
Sand snow,  மணல்சார் பனி, 
Sandstone dike,  மணற்கல் மடுகரை: மணற்கல் கரை: மணற்கல் அணைகரை, 
Sand strength,  மணல் வலிமை: மணல் வலிவு, 
Sand trap,  மணற் பிடிப்பி: மணற்கண்ணிப்பொறி, 
Sand wave,  மணல் முகட்டு அலை: மணலலை, அலைமுகட்டு மணல் படிவு, 
Sand wedge,  ஆப்புவடிவ மணல்சேர்ப்பு, ஆப்புரு - மணல்திரட்சி, ஆப்புவடிவ மணல் விரிசல், 
Sand wheel,  மணல் தூக்கு உருளை: மணற் சக்கரம், 
Sandwich board,  இருபுற விளம்பர அட்டை, 
Sandwich boat,  ஊடேறு படகு, 
Sandwich compound,  இடையீட்டுச் சேர்மம், 
Sandwich construction,  இடையீட்டடுக்குக் கட்டுமானம்;- இடைவைப்புக் கட்டுமானம், 
Sandwich course,  தொழிலிடைக் கல்வித்திட்டம்/ கல்வி தொழில் கலவைக்கடவை, 
Sandwich heating,  வெப்பக் குழைமத்தாள் சூடாக்கல்;- இடைவைத்துச் டாக்கு முறை பொறி, 
Sandwich man,  முன்பின் இருவகை விளம்பரமேந்தி, 
Sandwich panel,  இடையீட்டுப் பாத்தி, 
Sandwich technique,  இடைச்செருகல் - நுட்பம், 
Sandwich winding,  இடைச்செருகல் சுருணை, அடுக்கு இடையீட்டுச் சுருணை, 
Sandy gravel,  மணற்பரளை: மணற்சரளை: மணற் சரளை, 
Sandy land,  பொதிமணல் தரை, 
Sane,  இயல்அறிவுள்ள, உளத்துலக்கம்; நல்ல மனநிலை, தெளிந்த அறிவுள்ள; நல்லறிவு நிலையுடைய, உளநலம், 
Sand flood,  மணல் வெள்ளம், பாலைவன மணல்வீச்சு, பாலைவன மணல் இயக்கம், 
Sand flow,  மணற்பாய்வு, 
Sandfly fever,  மணலீக் காய்ச்சல்: மணல்பூச்சி காய்ச்சல், 
Sand glass,  மணற்கடிகை மணல் நாழிகைவட்டில்: மணல் நாழிகை வட்டில்: மணல் வட்டில், 
Sand-grain meter,  மணல்மணி மானி, 
Sand grains,  மணல் - துகள்கள், 
Sand gravel,  மணற்சரளை, 
Sand grinding,  மணல் அரைத்தல், 
Sand grouse,  மணற்கதுவாலி கற்கதுவாலி, 
Sand heaps,  மணற்குவியல்கள், 
Sand hill spring,  தேரி-ஊற்று, 
Sand hole,  மணல் துளை: மண்குதிர்/ கடல் அலைக்குழி, 
Sand horn,  மணல் கூர்ப்படிவு: மணற்கொம்பு: மணல் கூர்ம்படிவு, 
Sanding,  மண்ணடித்தல்: மண்ணால் மூடுறுதல்: மணல்மூடல்: மண் கலத்தல், பரப்பு மென்மையாக்கல்: மணல்கலத்தல், 
Sanding machine,  மண்ணீட்டுப் பொறி, 
Sand island method,  மணல்திட்டு முறை, 
Sand jet,  மணல் வீச்சு, 
Sand joint,  மணல் மூட்டு, 
Sand load,  மணல் மின்சுமை: மணற்சுமை, 
Sand lobe,  மணல் வட்டெக்கர்/ காயலுரு மணற்படிவு; நீர்வட்ட மணற்படிவு, 
Sand martin,  மணற்கரைக்கூட்டுப்-புள், 
Sand mill,  மணலாலை: மணல் துருவல் ஆலை, 
Sand moisture,  மணல் ஈரப்பதன்: மணல் ஈரப்பதம், 
Sand mould,  மணற்குழிவு வார்ப்பு, 
Sandoricum koetjape,  சாயமரம், 
Sand paper fig,  மண்டாளத்தி: மண்தாள் - அத்தி, 
Sand papering machine,  அரத்தாள் எந்திரம், 
